{
  "record_type": "zygor_zone_map_bindings",
  "schema_version": "1.0",
  "client_build": "2.4.3.8606",
  "provenance": "client_world_map_area_reviewed",
  "bindings": [
    {"zone": "Alterac Mountains", "map_id": 0, "map_name": "Azeroth"},
    {"zone": "Arathi Highlands", "map_id": 0, "map_name": "Azeroth"},
    {"zone": "Ashenvale", "map_id": 1, "map_name": "Kalimdor"},
    {"zone": "Azshara", "map_id": 1, "map_name": "Kalimdor"},
    {"zone": "Azuremyst Isle", "map_id": 530, "map_name": "Expansion01"},
    {"zone": "Badlands", "map_id": 0, "map_name": "Azeroth"},
    {"zone": "Black Temple", "map_id": 564, "map_name": "BlackTemple"},
    {"zone": "Blackwing Lair", "map_id": 469, "map_name": "BlackwingLair"},
    {"zone": "Blade's Edge Mountains", "map_id": 530, "map_name": "Expansion01"},
    {"zone": "Blasted Lands", "map_id": 0, "map_name": "Azeroth"},
    {"zone": "Bloodmyst Isle", "map_id": 530, "map_name": "Expansion01"},
    {"zone": "Burning Steppes", "map_id": 0, "map_name": "Azeroth"},
    {"zone": "Darkshore", "map_id": 1, "map_name": "Kalimdor"},
    {"zone": "Darnassus", "map_id": 1, "map_name": "Kalimdor"},
    {"zone": "Deadwind Pass", "map_id": 0, "map_name": "Azeroth"},
    {"zone": "Desolace", "map_id": 1, "map_name": "Kalimdor"},
    {"zone": "Dun Morogh", "map_id": 0, "map_name": "Azeroth"},
    {"zone": "Durotar", "map_id": 1, "map_name": "Kalimdor"},
    {"zone": "Duskwood", "map_id": 0, "map_name": "Azeroth"},
    {"zone": "Dustwallow Marsh", "map_id": 1, "map_name": "Kalimdor"},
    {"zone": "Eastern Kingdoms", "map_id": 0, "map_name": "Azeroth"},
    {"zone": "Eastern Plaguelands", "map_id": 0, "map_name": "Azeroth"},
    {"zone": "Elwynn Forest", "map_id": 0, "map_name": "Azeroth"},
    {"zone": "Eversong Woods", "map_id": 530, "map_name": "Expansion01"},
    {"zone": "Felwood", "map_id": 1, "map_name": "Kalimdor"},
    {"zone": "Feralas", "map_id": 1, "map_name": "Kalimdor"},
    {"zone": "Ghostlands", "map_id": 530, "map_name": "Expansion01"},
    {"zone": "Hellfire Peninsula", "map_id": 530, "map_name": "Expansion01"},
    {"zone": "Hillsbrad Foothills", "map_id": 0, "map_name": "Azeroth"},
    {"zone": "Ironforge", "map_id": 0, "map_name": "Azeroth"},
    {"zone": "Isle of Quel'Danas", "map_id": 530, "map_name": "Expansion01"},
    {"zone": "Kalimdor", "map_id": 1, "map_name": "Kalimdor"},
    {"zone": "Loch Modan", "map_id": 0, "map_name": "Azeroth"},
    {"zone": "Moonglade", "map_id": 1, "map_name": "Kalimdor"},
    {"zone": "Mulgore", "map_id": 1, "map_name": "Kalimdor"},
    {"zone": "Nagrand", "map_id": 530, "map_name": "Expansion01"},
    {"zone": "Netherstorm", "map_id": 530, "map_name": "Expansion01"},
    {"zone": "Orgrimmar", "map_id": 1, "map_name": "Kalimdor"},
    {"zone": "Redridge Mountains", "map_id": 0, "map_name": "Azeroth"},
    {"zone": "Searing Gorge", "map_id": 0, "map_name": "Azeroth"},
    {"zone": "Shadowmoon Valley", "map_id": 530, "map_name": "Expansion01"},
    {"zone": "Shattrath City", "map_id": 530, "map_name": "Expansion01"},
    {"zone": "Silithus", "map_id": 1, "map_name": "Kalimdor"},
    {"zone": "Silvermoon City", "map_id": 530, "map_name": "Expansion01"},
    {"zone": "Silverpine Forest", "map_id": 0, "map_name": "Azeroth"},
    {"zone": "Stonetalon Mountains", "map_id": 1, "map_name": "Kalimdor"},
    {"zone": "Stormwind City", "map_id": 0, "map_name": "Azeroth"},
    {"zone": "Stranglethorn Vale", "map_id": 0, "map_name": "Azeroth"},
    {"zone": "Swamp of Sorrows", "map_id": 0, "map_name": "Azeroth"},
    {"zone": "Tanaris", "map_id": 1, "map_name": "Kalimdor"},
    {"zone": "Teldrassil", "map_id": 1, "map_name": "Kalimdor"},
    {"zone": "Terokkar Forest", "map_id": 530, "map_name": "Expansion01"},
    {"zone": "The Barrens", "map_id": 1, "map_name": "Kalimdor"},
    {"zone": "The Exodar", "map_id": 530, "map_name": "Expansion01"},
    {"zone": "The Hinterlands", "map_id": 0, "map_name": "Azeroth"},
    {"zone": "Thousand Needles", "map_id": 1, "map_name": "Kalimdor"},
    {"zone": "Thunder Bluff", "map_id": 1, "map_name": "Kalimdor"},
    {"zone": "Tirisfal Glades", "map_id": 0, "map_name": "Azeroth"},
    {"zone": "Un'Goro Crater", "map_id": 1, "map_name": "Kalimdor"},
    {"zone": "Undercity", "map_id": 0, "map_name": "Azeroth"},
    {"zone": "Western Plaguelands", "map_id": 0, "map_name": "Azeroth"},
    {"zone": "Westfall", "map_id": 0, "map_name": "Azeroth"},
    {"zone": "Wetlands", "map_id": 0, "map_name": "Azeroth"},
    {"zone": "Winterspring", "map_id": 1, "map_name": "Kalimdor"},
    {"zone": "Zangarmarsh", "map_id": 530, "map_name": "Expansion01"}
  ],
  "execution_authority": false
}
